{
  "$schema": "https://json-schema.org/draft/2020-12/schema",
  "$id": "urn:fusion:schema:fusion.migration-proposal/v1",
  "title": "fusion.migration-proposal/v1",
  "description": "The host's mapping proposal, the input the migration's plan phase reads from .json-state/migration/ by {path, sha256} (FJ04 contract delta, amended for Prior ab9cb59 and a1fb17a). The host composes it from the legacy v12 Markdown (hooks/lib/legacy-import.ts composeProposal) and writes nothing else; the codec reads it, never writes it, and freezes it into fusion.migration-plan/v1's index and parts. It never travels and is no control record, so the 1 MiB record cap does not bind it; its cap is 16 MiB. A proposal that does not validate here is refused schema-invalid/proposal-invalid. It carries the record cut with fresh UUIDs, each record's target control, the backup path of its original, and, for a live narrative the import changes, the rewrite as byte deletions bound by the record's source_sha256 before and the rewrite's after_sha256 behind. It also carries every finding of both severities, the repair log of the consented repairs, the root exclusions the host selects from the codec's fixed allowlist, and every operation id of the run, frozen before dispatch (request 45f). It carries the digest of the eligible source inventory it was composed from, not its entries: plan takes its own inventory under the lock and digests it. Rules JSON Schema cannot check, each refused by plan in the contract's order: no UUID occurs twice across operation_ids' four members, none already has a stored answer or an intent in this workbench, the request's operation_id is operation_ids.plan, and once the writes are cut apply holds at least one id per chunk and rollback at least one more than that (proposal-invalid); an exclusion holds no narrative or control path the plan reads or writes (proposal-invalid); a record UUID occurs once across workbench_id and the records' keys, and each control's id is its key and its workbench_id the proposal's (duplicate-id); no control path is present on disk (conflict/record-exists); the eligible inventory plan takes under the lock digests to source_inventory_sha256, checked first in the Disk step (conflict/source-changed, naming both digests); no finding is blocking (migration-incomplete/blocking-finding); every record_ref at every reference site names a proposed record (closure-incomplete); every source_sha256 matches the inventory plan takes (conflict/source-changed). Also unchecked here: backup is archive/migrations/<migration_id>/originals/<narrative>; deletion ranges ascend, do not overlap and lie inside the source bytes, and applying them gives after_sha256 (proposal-invalid); a terminal record has no rewrite. A proposal naming no record is admitted; the cut then makes one chunk with no write.",
  "type": "object",
  "additionalProperties": false,
  "required": ["counts", "exclusions", "findings", "migration_id", "operation_ids", "records", "repairs", "schema", "source_inventory_sha256", "source_layout", "workbench_id"],
  "properties": {
    "schema": { "const": "fusion.migration-proposal/v1" },
    "migration_id": { "$ref": "urn:fusion:schema:fusion.migration-plan/v1#/$defs/migration_id" },
    "workbench_id": { "$ref": "urn:fusion:schema:fusion.common/v1#/$defs/uuid", "description": "The new workbench UUID, fixed in the index and reused by a resume." },
    "source_layout": { "$ref": "urn:fusion:schema:fusion.migration-plan/v1#/$defs/source_layout" },
    "source_inventory_sha256": { "$ref": "urn:fusion:schema:fusion.migration-plan/v1#/$defs/source_inventory_sha256", "description": "survey's eligible_sha256 from the survey run after the last consented repair and before composition, whose entries the host composed from; the index carries the same value." },
    "operation_ids": {
      "type": "object",
      "description": "Every operation id of the run, chosen by the caller and frozen before dispatch (request 45f). plan assigns apply[i-1] to chunk i (chunk 1's also names the fence it sets) and rollback[k] to rollback chunk k from 0 to the chunk count, fixes them in the index's schedule, and lists the surplus ids there as unassigned.",
      "additionalProperties": false,
      "required": ["apply", "plan", "rollback", "verify"],
      "properties": {
        "plan": { "$ref": "urn:fusion:schema:fusion.common/v1#/$defs/uuid", "description": "The plan request's own operation_id." },
        "apply": { "type": "array", "minItems": 1, "uniqueItems": true, "items": { "$ref": "urn:fusion:schema:fusion.common/v1#/$defs/uuid" } },
        "verify": { "$ref": "urn:fusion:schema:fusion.common/v1#/$defs/uuid" },
        "rollback": { "type": "array", "minItems": 2, "uniqueItems": true, "items": { "$ref": "urn:fusion:schema:fusion.common/v1#/$defs/uuid" }, "description": "Rollback chunk 0's id included, so always one more than the apply ids a cut uses." }
      }
    },
    "exclusions": { "$ref": "urn:fusion:schema:fusion.migration-plan/v1#/$defs/exclusions" },
    "records": {
      "type": "object",
      "description": "The record cut, keyed by the fresh record UUID. A UUID repeated as a key is refused by the strict reader (duplicate-key).",
      "propertyNames": { "$ref": "urn:fusion:schema:fusion.common/v1#/$defs/uuid" },
      "additionalProperties": { "$ref": "#/$defs/record" }
    },
    "counts": { "$ref": "urn:fusion:schema:fusion.migration-plan/v1#/$defs/counts" },
    "findings": {
      "type": "array",
      "description": "Every finding of the reader, blocking and reported. A blocking one is admitted here and refused by plan as migration-incomplete/blocking-finding; the reported ones are frozen into the plan's findings parts, which the receipt binds by hash.",
      "items": { "$ref": "urn:fusion:schema:fusion.migration-plan/v1#/$defs/finding" }
    },
    "repairs": {
      "type": "array",
      "description": "The repair log of step 8 (the session's repair-log.jsonl, outside the workbench), carried inline in the order applied, since the codec reads nothing outside the workbench; plan freezes it into the repairs parts.",
      "items": { "$ref": "urn:fusion:schema:fusion.migration-plan/v1#/$defs/repair" }
    }
  },
  "$defs": {
    "record": {
      "type": "object",
      "description": "One converted pair: its row of the record cut, its narrative as read, its new control file and the control it will carry.",
      "additionalProperties": false,
      "required": ["backup", "control", "control_path", "kind", "narrative", "rewrite", "row", "source_sha256"],
      "properties": {
        "row": { "type": "string", "enum": ["package-live", "package-terminal", "record-live", "record-closure"] },
        "kind": { "type": "string", "enum": ["package", "issue", "plan", "discussion", "decision"] },
        "narrative": { "$ref": "urn:fusion:schema:fusion.common/v1#/$defs/narrative/properties/path" },
        "source_sha256": { "$ref": "urn:fusion:schema:fusion.common/v1#/$defs/sha256", "description": "The narrative's bytes as the survey hashed them, after repair: the original's hash and a rewrite's before-hash." },
        "control_path": {
          "allOf": [
            { "$ref": "urn:fusion:schema:fusion.common/v1#/$defs/workbench_path" },
            { "type": "string", "pattern": "(^|/)(package|[^/]+\\.record)\\.json$" }
          ]
        },
        "backup": {
          "allOf": [
            { "$ref": "urn:fusion:schema:fusion.common/v1#/$defs/workbench_path" },
            { "type": "string", "pattern": "^archive/migrations/migration-[0-9]{8}-[a-z0-9-]+/originals/.+\\.md$" }
          ],
          "description": "Where the original goes; the control's provenance.backup names the same path."
        },
        "rewrite": {
          "description": "null when the narrative stays byte-identical (every terminal record, and a live one with nothing to remove).",
          "oneOf": [
            { "type": "null" },
            {
              "type": "object",
              "additionalProperties": false,
              "required": ["after_sha256", "deletions"],
              "properties": {
                "after_sha256": { "$ref": "urn:fusion:schema:fusion.common/v1#/$defs/sha256" },
                "deletions": { "$ref": "urn:fusion:schema:fusion.migration-plan/v1#/$defs/deletions" }
              }
            }
          ]
        },
        "control": {
          "oneOf": [
            { "$ref": "urn:fusion:schema:fusion.package/v1" },
            { "$ref": "urn:fusion:schema:fusion.record/v1" }
          ]
        }
      }
    }
  }
}
