{
  "schema": "fusion.migration-proposal/v1",
  "migration_id": "migration-20261002-example",
  "workbench_id": "5d6d15ba-5b44-45b2-8aa2-39dd3bf82964",
  "source_layout": "fusion-v12",
  "source_inventory_sha256": "sha256:5f5f5f5f5f5f5f5f5f5f5f5f5f5f5f5f5f5f5f5f5f5f5f5f5f5f5f5f5f5f5f5f",
  "operation_ids": {
    "plan": "9c2e4a6b-3d5f-4b7a-8e1c-0f2a4c6e8b3d",
    "apply": [
      "4b8d2f6a-1c3e-4a5b-9d7f-2e4c6a8b0d1f",
      "6f0a2c4e-8b1d-4e3f-a5c7-9d1b3f5a7c2e",
      "7c9e1b3d-5f6a-4e0b-b2c4-9a1e3c5b7d0a"
    ],
    "verify": "1a3c5e7b-9d2f-4c6e-b8a0-3e5c7a9b1d4f",
    "rollback": [
      "2d4f6a8c-0e1b-4d3f-9a5c-7e9b1d3f5a6c",
      "3e5a7c9b-1d2f-4a6c-8e0b-5c7a9e1b3d6f",
      "5a7c9e1b-3d4f-4c8e-a0b2-7e9c1a3d5f8b"
    ]
  },
  "exclusions": [
    ".fusion-setup",
    "orchestrator-events.jsonl"
  ],
  "records": {
    "c659cc62-52e9-4887-8617-124715712a64": {
      "row": "package-live",
      "kind": "package",
      "narrative": "work-packages/260920-0900-lint-cleanup/260920-0900-lint-cleanup.md",
      "source_sha256": "sha256:cccccccccccccccccccccccccccccccccccccccccccccccccccccccccccccccc",
      "control_path": "work-packages/260920-0900-lint-cleanup/package.json",
      "backup": "archive/migrations/migration-20261002-example/originals/work-packages/260920-0900-lint-cleanup/260920-0900-lint-cleanup.md",
      "rewrite": {
        "after_sha256": "sha256:eeeeeeeeeeeeeeeeeeeeeeeeeeeeeeeeeeeeeeeeeeeeeeeeeeeeeeeeeeeeeeee",
        "deletions": [
          {
            "offset": 42,
            "length": 17
          },
          {
            "offset": 60,
            "length": 31
          }
        ]
      },
      "control": {
        "schema": "fusion.package/v1",
        "id": "c659cc62-52e9-4887-8617-124715712a64",
        "workbench_id": "5d6d15ba-5b44-45b2-8aa2-39dd3bf82964",
        "domain": "code",
        "status": "open",
        "claim": null,
        "mode": {
          "value": "ordinary",
          "source": {
            "kind": "legacy",
            "raw": "**Mode:** ordinary"
          }
        },
        "origin": {
          "kind": "user-request",
          "ref": null
        },
        "filed_by": {
          "actor": "user",
          "person": "example-person"
        },
        "narrative": {
          "path": "work-packages/260920-0900-lint-cleanup/260920-0900-lint-cleanup.md"
        },
        "depends_on": [],
        "active_documents": [],
        "references": [
          "260920-0800_a_is-the-lint-package-ordinary.md"
        ],
        "evidence": [],
        "outcome": null,
        "provenance": {
          "source": "imported",
          "legacy_fields": {
            "file_marker": null,
            "head": {
              "Status": "open",
              "Mode": "ordinary"
            }
          },
          "backup": {
            "path": "archive/migrations/migration-20261002-example/originals/work-packages/260920-0900-lint-cleanup/260920-0900-lint-cleanup.md",
            "sha256": "sha256:cccccccccccccccccccccccccccccccccccccccccccccccccccccccccccccccc",
            "kind": "other"
          }
        },
        "extensions": {}
      }
    },
    "8e1f3a5c-7b9d-4c2e-a4f6-1d3b5c7e9f0a": {
      "row": "record-live",
      "kind": "issue",
      "narrative": "work-packages/260920-0900-lint-cleanup/issues/260921-1000_o_lint-rule-misfires.md",
      "source_sha256": "sha256:3333333333333333333333333333333333333333333333333333333333333333",
      "control_path": "work-packages/260920-0900-lint-cleanup/issues/260921-1000_o_lint-rule-misfires.record.json",
      "backup": "archive/migrations/migration-20261002-example/originals/work-packages/260920-0900-lint-cleanup/issues/260921-1000_o_lint-rule-misfires.md",
      "rewrite": null,
      "control": {
        "schema": "fusion.record/v1",
        "id": "8e1f3a5c-7b9d-4c2e-a4f6-1d3b5c7e9f0a",
        "workbench_id": "5d6d15ba-5b44-45b2-8aa2-39dd3bf82964",
        "kind": "issue",
        "narrative": {
          "path": "work-packages/260920-0900-lint-cleanup/issues/260921-1000_o_lint-rule-misfires.md"
        },
        "filed_by": {
          "actor": "reviewer",
          "person": null
        },
        "references": [],
        "provenance": {
          "source": "imported",
          "legacy_fields": {
            "file_marker": "o",
            "head": {}
          },
          "backup": {
            "path": "archive/migrations/migration-20261002-example/originals/work-packages/260920-0900-lint-cleanup/issues/260921-1000_o_lint-rule-misfires.md",
            "sha256": "sha256:3333333333333333333333333333333333333333333333333333333333333333",
            "kind": "other"
          }
        },
        "extensions": {},
        "control": {
          "state": "open",
          "disposition": null
        }
      }
    }
  },
  "counts": {
    "package_live": 1,
    "package_terminal": 0,
    "record_live": 1,
    "record_closure": 0,
    "plain_terminal": 3,
    "empty_container": 0
  },
  "findings": [
    {
      "class": "reference-not-a-citation",
      "severity": "reported",
      "path": "work-packages/260920-0900-lint-cleanup/260920-0900-lint-cleanup.md",
      "detail": "the lint ticket"
    },
    {
      "class": "unresolvable-live-dependency",
      "severity": "blocking",
      "path": "work-packages/260920-0900-lint-cleanup/260920-0900-lint-cleanup.md",
      "detail": "260901-0900-gone.md"
    }
  ],
  "repairs": [
    {
      "finding": {
        "class": "filed-by-missing",
        "severity": "blocking",
        "path": "work-packages/260920-0900-lint-cleanup/260920-0900-lint-cleanup.md",
        "detail": "null"
      },
      "answers": {
        "actor": "user",
        "person": "example-person"
      },
      "pre_sha256": "sha256:1111111111111111111111111111111111111111111111111111111111111111",
      "post_sha256": "sha256:cccccccccccccccccccccccccccccccccccccccccccccccccccccccccccccccc"
    }
  ]
}
